{"ambiguities":[],"candidates":[{"action":{"direction":null,"distance":null,"execution_class":"ACTION","intensity":null,"object_ref":null,"primitive":null,"quantity":1,"subtype":"PUNCH","target_zone":null,"targets":[{"entity_id":"b","source_span":null}],"type":"ATTACK"},"confidence":{"action":0.8,"intent_type":0.8,"target":0.8},"intent_type":"ACTION"}],"errors":[],"intent":{"action":{"direction":null,"distance":null,"execution_class":"ACTION","intensity":null,"object_ref":null,"primitive":null,"quantity":1,"subtype":"PUNCH","target_zone":null,"targets":[{"entity_id":"b","source_span":null}],"type":"ATTACK"},"actor_id":"a","confidence":{"action":0.8,"intent_type":0.8,"overall":0.8,"target":0.8},"intent_id":"semantic:0c96dde5217a66b4","intent_type":"ACTION","locale":"es","normalized_text":"le meto un viaje","original_text":"le meto un viaje","provenance":{"cache_status":"MISS","dictionary_entries":[],"dictionary_hash":"b4c1afab8b3dd961c46725c941ef11a495f304940652a8af9f44483701734f8d","fallback_provider_id":"golden-mock","locale":"es","parser_path":"FALLBACK","parser_version":"0.5.0","rule_ids":[],"source_spans":[]}},"normalization":{"matching_text":"le meto un viaje","normalized_text":"le meto un viaje","original_text":"le meto un viaje","tokens":[{"end":2,"match":"le","start":0,"text":"le"},{"end":7,"match":"meto","start":3,"text":"meto"},{"end":10,"match":"un","start":8,"text":"un"},{"end":16,"match":"viaje","start":11,"text":"viaje"}]},"status":"RESOLVED"}
