{"ambiguities":[],"candidates":[],"errors":[],"intent":{"action":{"direction":null,"distance":null,"execution_class":"ACTION","intensity":null,"object_ref":null,"primitive":null,"quantity":1,"subtype":"PUNCH","target_zone":null,"targets":[{"entity_id":"b","source_span":null}],"type":"ATTACK"},"actor_id":"a","confidence":{"action":0.95,"intent_type":0.9,"overall":0.88,"subtype":0.95,"target":0.88},"intent_id":"semantic:93b9393648478da2","intent_type":"ACTION","locale":"es","normalized_text":"le pego","original_text":"le pego","provenance":{"cache_status":"MISS","dictionary_entries":["core.es.attack.punch"],"dictionary_hash":"b4c1afab8b3dd961c46725c941ef11a495f304940652a8af9f44483701734f8d","fallback_provider_id":null,"locale":"es","parser_path":"RULE","parser_version":"0.5.0","rule_ids":["structure.single"],"source_spans":[{"end":7,"start":0}]}},"normalization":{"matching_text":"le pego","normalized_text":"le pego","original_text":"le pego","tokens":[{"end":2,"match":"le","start":0,"text":"le"},{"end":7,"match":"pego","start":3,"text":"pego"}]},"status":"RESOLVED"}
