{"ambiguities":[],"candidates":[],"errors":[],"intent":{"actor_id":"a","confidence":{"action":0.95,"intent_type":0.9,"overall":0.9,"subtype":0.95,"target":0.95},"intent_id":"semantic:f23ac1f35dd73d84","intent_type":"STRATEGY","locale":"es","normalized_text":"tiro algo a su izquierda para distraerlo y me muevo detrás","original_text":"tiro algo a su izquierda para distraerlo y me muevo detrás","provenance":{"cache_status":"MISS","dictionary_entries":["core.es.throw.object","core.es.strategy.distraction","core.es.strategy.reposition"],"dictionary_hash":"b4c1afab8b3dd961c46725c941ef11a495f304940652a8af9f44483701734f8d","fallback_provider_id":null,"locale":"es","parser_path":"RULE","parser_version":"0.5.0","rule_ids":["structure.strategy"],"source_spans":[{"end":9,"start":0},{"end":40,"start":30},{"end":58,"start":43}]},"strategy":{"owner":"a","steps":[{"action":{"direction":"BEHIND","distance":null,"execution_class":"ACTION","intensity":null,"object_ref":"declared_object","primitive":null,"quantity":1,"subtype":"THROW_OBJECT","target_zone":null,"targets":[{"entity_id":"b","source_span":null}],"type":"THROW"},"depends_on":[],"execution_class":"ACTION","kind":"ACTION","primitive":null,"step_id":"step_1"},{"action":{"direction":"BEHIND","distance":null,"execution_class":"ACTION","intensity":null,"object_ref":null,"primitive":"DISTRACTION","quantity":1,"subtype":null,"target_zone":null,"targets":[{"entity_id":"b","source_span":null}],"type":"DISTRACTION"},"depends_on":["step_1"],"execution_class":"ACTION","kind":"PRIMITIVE","primitive":"DISTRACTION","step_id":"step_2"},{"action":{"direction":"BEHIND","distance":null,"execution_class":"MOVEMENT","intensity":null,"object_ref":null,"primitive":"REPOSITION","quantity":1,"subtype":null,"target_zone":null,"targets":[{"entity_id":"b","source_span":null}],"type":"REPOSITION"},"depends_on":["step_2"],"execution_class":"MOVEMENT","kind":"PRIMITIVE","primitive":"REPOSITION","step_id":"step_3"}],"strategy_id":"semantic:f23ac1f35dd73d84:strategy"}},"normalization":{"matching_text":"tiro algo a su izquierda para distraerlo y me muevo detras","normalized_text":"tiro algo a su izquierda para distraerlo y me muevo detrás","original_text":"tiro algo a su izquierda para distraerlo y me muevo detrás","tokens":[{"end":4,"match":"tiro","start":0,"text":"tiro"},{"end":9,"match":"algo","start":5,"text":"algo"},{"end":11,"match":"a","start":10,"text":"a"},{"end":14,"match":"su","start":12,"text":"su"},{"end":24,"match":"izquierda","start":15,"text":"izquierda"},{"end":29,"match":"para","start":25,"text":"para"},{"end":40,"match":"distraerlo","start":30,"text":"distraerlo"},{"end":42,"match":"y","start":41,"text":"y"},{"end":45,"match":"me","start":43,"text":"me"},{"end":51,"match":"muevo","start":46,"text":"muevo"},{"end":58,"match":"detras","start":52,"text":"detrás"}]},"status":"RESOLVED"}
